{
  "contract_schema": 1,
  "unit": {
    "phase_id": "design-harness",
    "skill": "metabuilder-harness-design",
    "semantic_version": "1.1.0",
    "guidance_digest": "9777298d85a548e2838304a0b2248e7019f77ef50dcbeecef445e487984b0303"
  },
  "inputs": [
    {
      "name": "objective_request",
      "epistemic_class": "human_decision",
      "required": true,
      "cardinality": "one"
    },
    {
      "name": "product_thesis",
      "epistemic_class": "artifact",
      "required": false,
      "cardinality": "zero-or-one",
      "schema_digest": null
    },
    {
      "name": "resolved_questions",
      "epistemic_class": "artifact",
      "required": false,
      "cardinality": "zero-or-one"
    },
    {
      "name": "ratified_charter",
      "epistemic_class": "artifact",
      "required": false,
      "cardinality": "zero-or-one"
    },
    {
      "name": "execution_dag",
      "epistemic_class": "artifact",
      "required": false,
      "cardinality": "zero-or-one"
    },
    {
      "name": "continuation_handoff",
      "epistemic_class": "artifact",
      "required": false,
      "cardinality": "zero-or-one",
      "schema_digest": "740a656e490f038e09bcf54df25b6fde90d1ce9bc25d4da8441e7b75a1464519",
      "schema_path": "../../references/continuation-state.schema.json"
    },
    {
      "name": "routing_context",
      "epistemic_class": "diagnostic",
      "required": false,
      "cardinality": "zero-or-one",
      "schema_path": "../ports/routing-diagnostic.schema.json",
      "schema_digest": "13045567de1dfc1a9c8c74775d037de10200ef1633fad01d2a35ec3687e33026"
    }
  ],
  "outputs": [
    {
      "name": "design_packet",
      "epistemic_class": "claim",
      "cardinality": "one",
      "artifact_kind": "brief + intent source + module + bundle identities + stop decisions",
      "schema_path": "../ports/design-packet.schema.json",
      "schema_digest": "a0b8df7148f95b75e8d1258919e41ea4f059e144ff9acc49ebe3d68824c579dc"
    }
  ],
  "preconditions": {
    "prior_stages": [
      "classify-work-horizon"
    ],
    "approvals": [
      "named product owner approves every formal decision",
      "every required approver accepts the exact prepared brief digest"
    ],
    "toolchains": [
      "metabuilder"
    ],
    "platforms": []
  },
  "failures": [
    {
      "failure_type": "invalid_input",
      "retryable": true,
      "recovery": "Hold the affected decision; finish independent authorized preparation and request the specific missing decision."
    },
    {
      "failure_type": "denied_effect",
      "retryable": false,
      "recovery": "Stop at the unsupported effect boundary; emit design-only handoff labeling uncreated downstream identities."
    },
    {
      "failure_type": "conclusive_failure",
      "retryable": true,
      "recovery": "Return upstream to preparation; never repair the design silently inside qualification."
    }
  ],
  "effects": [
    {
      "kind": "filesystem",
      "mode": "read",
      "ceiling": "target repository reads"
    },
    {
      "kind": "process",
      "mode": "execute",
      "ceiling": "metabuilder CLI brief/intent/compile/check operations"
    },
    {
      "kind": "filesystem",
      "mode": "write",
      "ceiling": "design artifacts in authorized local output paths"
    }
  ],
  "determinism": {
    "status": "effectful",
    "canonical_serialization": "brief/intent/module/bundle JSON artifacts with digests",
    "replay_inputs": false,
    "nondeterminism_notes": "CLI admission is deterministic over exact bytes; grilling and ratification are human-in-the-loop."
  },
  "resources": {
    "time_budget": "design session bounded by the campaign envelope"
  },
  "authority": {
    "attenuate_only": true,
    "author": "rahulskills",
    "human_gates": [
      "Formal construction requires named product-owner ratification and acceptance of the exact prepared brief digest.",
      "Design acceptance alone authorizes no execution, provider dispatch, or spend."
    ],
    "ceiling": [
      "design artifacts only; target source receives no mutation authority"
    ]
  },
  "evidence": {
    "acceptance_checks": [
      "metabuilder intent check exits zero for the defineIntent rendition",
      "metabuilder harness compile + harness check exit zero for the exact module and bundle"
    ],
    "artifact_provenance": [
      "finding ledger",
      "candidate/prepared/agreed brief identities",
      "checked intent source",
      "compiled and re-admitted module and bundle identities"
    ],
    "journal_events": [],
    "report_boundary": "No production-readiness claim; explicit qualification handoff only."
  },
  "compatibility": {
    "breaking_widenings": [
      "effect",
      "authority",
      "confinement",
      "resource",
      "recovery",
      "output_meaning"
    ]
  }
}
